{
  "id": "nilovelez-camptix-badge-generator",
  "title": "Camptix Badge Generator",
  "description": "Processes Camptix csv export files and generates PDF Badges ready to print",
  "status": "active",
  "status_text": "Development is starting: the repository has been created and no code has been written yet. Next step is reading Camptix CSV exports.",
  "last_update": "2026-10-31 07:55:33 +0100",
  "last_update_unix": 1793429733,
  "url": "https://github.com/nilovelez/camptix-badge-generator",
  "status_url": "https://raw.githubusercontent.com/nilovelez/camptix-badge-generator/main/guppy/STATUS.md",
  "icon": null
}
