{
  "id": "nilovelez-wp-agentic-workflow",
  "title": "wp-agentic-workflow",
  "description": "Public Claude Code skill that sets up and guides a WordPress plugin development workflow, from local test sites to WordPress.org submission.",
  "status": "active",
  "status_text": "The first version of the skill is written and awaiting review. Next: merge it and test it on a new plugin.",
  "last_update": "2026-10-13 14:56:07 +0200",
  "last_update_unix": 1791896167,
  "url": "https://github.com/nilovelez/wp-agentic-workflow",
  "status_url": "https://raw.githubusercontent.com/nilovelez/wp-agentic-workflow/main/guppy/STATUS.md",
  "icon": null
}
