{
  "id": "nilovelez-quevedo",
  "title": "Quevedo",
  "description": "WordPress plugin with writing-focused tools: removes features single-author blogs don't need, simplifies the editor and adds Open Graph metadata.",
  "status": "active",
  "status_text": "Version 1.5 is published in the WordPress.org plugin directory, requiring PHP 8.2 and tested up to WordPress 7.1. No work in progress.",
  "last_update": "2026-10-18 22:24:51 +0200",
  "last_update_unix": 1792355091,
  "url": "https://github.com/nilovelez/quevedo",
  "status_url": "https://raw.githubusercontent.com/nilovelez/quevedo/master/guppy/STATUS.md",
  "icon": "https://ps.w.org/quevedo/assets/icon-128x128.png"
}
